id,05,01,02,parsed_run_1,label_run_1,parsed_run_2,label_run_2,parsed_run_3,label_run_3,All_agree,tweet
_1039886625994694656,Sono una minaccia,Sono subdoli,Sono pericolosi,Sono subdoli,ann01,Sono una minaccia,ann05,Sono pericolosi,ann02,False,"L'immigrato che non piace alla sinistra razzista.Tanto di cappello a questo migrante,questi sono i migranti che voglio.Gli italiani non sono razzisti,anzi, sono fin troppo accoglienti.Non ne possono + di mantenere migranti che non lavorano ma delinquono.😐 https://t.co/dUH7RPydhO"
_1039985235549675520,Sono una minaccia,Sono subdoli,Sono pericolosi,Sono subdoli,ann01,Sono una minaccia,ann05,Sono pericolosi,ann02,False,Mattinata di ieri passata in un'aula di tribunale. 23 udienze al ruolo. Imputati stranieri 19; imputati italiani 4. Imputati stranieri presenti 0; imputati italiani presenti 4. Conclusione (del tutto personale); vengono tutti a delinquere qua e se ne fregano della nostra giustiz
_1040132464147083265,Sono tutelati,Sono incompatibili con noi,Peggiorano le nostre condizioni di vita,Sono incompatibili con noi,ann01,Sono tutelati,ann05,Peggiorano le nostre condizioni di vita,ann02,False,"PER I MIGRANTI ""CIBO NON BUONO"" E LO HANNO
GETTATO VIA. NESSUNO HA PENSATO
AGLI ITALIANI POVERI IN FILA PER UN PASTO ALLA ""CARITAS""
Profughi non lo mangiano, cibo gettato a sacchi – FOTO CHOC https://t.co/E9sZVtvpzd"
_1040142016544468992,Sono degli sfruttatori,Sono incompatibili con noi,Peggiorano le nostre condizioni di vita,Sono incompatibili con noi,ann01,Sono degli sfruttatori,ann05,Peggiorano le nostre condizioni di vita,ann02,False,"I politici di centro e sinistra non capiscono che lasciandoci invadere dai migranti ci troveremo con 3 gravi problemi:
Povertà, islam, lotte razziali! 
STOP IMMEDIATA A IMMIGRAZIONE AFROISLAMICA! https://t.co/MKM6tPPVFK"
_1040176023889948672,Sono una minaccia,Sono subdoli,Sono pericolosi,Sono subdoli,ann01,Sono una minaccia,ann05,Sono pericolosi,ann02,False,"La questione non é #rom si  rom no #migranti si  migranti no. NON VOGLIAMO I DELINQUENTI. Cinesi, neri, italiani, indiani non importa. NON É DIFFICILE. https://t.co/bRkYDaNGFt"
_1040234048482942976,Sono degli sfruttatori,Sono dei parassiti,Peggiorano le nostre condizioni di vita,Sono dei parassiti,ann01,Sono degli sfruttatori,ann05,Peggiorano le nostre condizioni di vita,ann02,False,"Sei proprio STUPIDO CAZZO
Ma chi cazzo li vuole gli aiuti per i MIGRANTI CLANDESTINI??????
Solo voi SINISTRI TRADITORI VENDUTI IPOCRITI VIGLIACCHI"
_1040262359653208067,Sono degli sfruttatori,Sono un problema,Fanno quello che vogliono senza contribuire,Sono un problema,ann01,Sono degli sfruttatori,ann05,Fanno quello che vogliono senza contribuire,ann02,False,"@Noiconsalvini La bella domanda è: se sono profughi, come fanno a sapere dove rivolgersi per denunciare una persona, da parte un ministro del governo italiano????
Chi li sta guidando???? Ci scommetterei una mano che proviene tutto dal pdisastro!!!!!"
_1040298619587506176,Sono una minaccia,Sono subdoli,Sono pericolosi,Sono subdoli,ann01,Sono una minaccia,ann05,Sono pericolosi,ann02,False,Naturalmente meglio omettere che il 27 era una risorsa migrante del Gambia. Tranquillo sindaco il centro di #Cagliari è ancora sicuro...come no.
_1040491551649136640,Sono una minaccia,Sono incompatibili con noi,Sono pericolosi,Sono incompatibili con noi,ann01,Sono una minaccia,ann05,Sono pericolosi,ann02,False,"all'arrivo dei #carabinieri le #donne #immigrate li hanno aggrediti con morsi, bastoni, calci e pugni https://t.co/dYp4MwuUCd"
_1040498716241788928,Sono degli sfruttatori,Sono subdoli,Sono pericolosi,Sono subdoli,ann01,Sono degli sfruttatori,ann05,Sono pericolosi,ann02,False,"ECCO LA MAPPA DI TUTTI GLI AEROPORTI LEGALI AFRICANI.

ORA MI CHIEDO E VI CHIEDO A VOI: PERCHÉ ""GLI IMMIGRATI"" PAGANO PROFUMATAMENTE GLI SCAFISTI ASSOLDATI DAL CRIMINE E NON PARTONO CON REGOLARE VIAGGIO CON RELATIVO BIGLIETTO CHE GLI COSTA PURE MENO DELLA SCENEGGIATA COL BARCONE? https://t.co/5XX2vC21aw"
_1040600167844667393,Sono degli sfruttatori,Sono dei parassiti,Peggiorano le nostre condizioni di vita,Sono dei parassiti,ann01,Sono degli sfruttatori,ann05,Peggiorano le nostre condizioni di vita,ann02,False,@Scarfoglio Immigrati regolari con tanto di documenti che LAVORANO non clandestini che si rifiutano di dare le generalità e si fanno mantenere succhiando il nostro welfare voi nella zucca cosa avete? Segatura? Ah no avete la merde lussemburghese
_1040657329157488641,Sono degli sfruttatori,Sono dei parassiti,Peggiorano le nostre condizioni di vita,Sono dei parassiti,ann01,Sono degli sfruttatori,ann05,Peggiorano le nostre condizioni di vita,ann02,False,@BarbaraRaval Che cafone. Vuole più #migranti? Beh che se li prenda e poi li mantenga pure. Noi vogliamo chi ci restituisca la possibilità di costruirci una famiglia e non chi le importa dall'Africa. #stopinvasione #blocconavalesubito
_1040908671272857600,Sono degli sfruttatori,Sono dei parassiti,Fanno quello che vogliono senza contribuire,Sono dei parassiti,ann01,Sono degli sfruttatori,ann05,Fanno quello che vogliono senza contribuire,ann02,False,@SkyTG24 MAI  PIU'  ISIS   PD  E LEU  AL GOVERNO  SI SPERA  - HANNO  FATTO  I PATTI   CON   LA  UE   CHE  DOBBIAMO  ACCOGLIERE  TUTTI  I MIGRANTI  E TENERLI.  E HANNO  LASCIATO 16 MILIONI  DI ITALIANI  SENZA  CASA  SENZA LAVORO.
_1040983712706506752,Sono una minaccia,Sono subdoli,Sono pericolosi,Sono subdoli,ann01,Sono una minaccia,ann05,Sono pericolosi,ann02,False,"Che nessuno si permetta di paragonare i nostri migranti italiani ai clandestini neri.
Essi andavano in patrie ostili per lavorare. Non per spacciare droghe, chiedere elemosine o per prostituirsi. https://t.co/GqWaOb2rku"
_1041036737521311745,Sono una minaccia,Sono subdoli,Sono pericolosi,Sono subdoli,ann01,Sono una minaccia,ann05,Sono pericolosi,ann02,False,"@MARIO_DerFriaul A questi non li indagano....sono gli INTOCCABILI. Quello che mi indispone sono le persone che continuano a sostenerli, in barba ad ogni umana decenza. Non gli bastano i rom di notte nelle loro case e gli #stupratori-che-scappano-dalla-guerra: aspettano Islam che li raddrizzi. .."
_1041648313202876417,Sono tutelati,Sono dei parassiti,Peggiorano le nostre condizioni di vita,Sono dei parassiti,ann01,Sono tutelati,ann05,Peggiorano le nostre condizioni di vita,ann02,False,"@fcancellato @Mura75Mura Segregazione chiedere di sapere se sono ricchi o meno e se approfittano indebitamente di un servizio? Agli italiani lo chiedono, perche' agli stranieri no, fammi capire?"
_1043951293998477312,Sono degli sfruttatori,Sono dei parassiti,Fanno quello che vogliono senza contribuire,Sono dei parassiti,ann01,Sono degli sfruttatori,ann05,Fanno quello che vogliono senza contribuire,ann02,False,@marcocappato Con Padre Pio al governo per i migranti dovrebbe essere una pacchia
_1044878480234754049,Sono tutelati,Sono dei parassiti,Sono pericolosi,Sono dei parassiti,ann01,Sono tutelati,ann05,Sono pericolosi,ann02,False,"@matteosalvinimi Qualcuno avvisi Renzi e compagnucci che guarda caso sono ROM. E di sicuro a dire del Pd sono dei poveri ragazzi che stavano cercando lavoro e visto nessuno li assume , senza partita iva , facevano i venditori porta a porta."
_1046853286207340544,Sono una minaccia,Sono subdoli,Sono pericolosi,Sono subdoli,ann01,Sono una minaccia,ann05,Sono pericolosi,ann02,False,"@BeppeSala @museobrera @ComuneMI @culturamilano @_MiBAC Anche Baggio purtroppo sta scalando posizioni in termini di visitatori di ROM. Prima non c erano, o erano nascosti. Ora grazie anche a @PierMaran ogni giorno sono sotto le nostre case. Promesse mantenute di @PierMaran ? 0 . Anche oggi siamo invasi dai rom. Ed è ottobre https://t.co/H7FiG8U0P7"
_1047428021119057920,Sono degli sfruttatori,Sono incompatibili con noi,Hanno una cultura diversa dalla nostra,Sono incompatibili con noi,ann01,Sono degli sfruttatori,ann05,Hanno una cultura diversa dalla nostra,ann02,False,"CASTEL VOLTURNO: GLI IMMIGRATI MINACCIANO: "" SE NON CI VERRA' CONCESSO DI RIMANERE QUI CON IL PERMESSO UMANITARIO SCATENEREMO IL CAOS"". 
QUESTI SI PERMETTONO DI MINACCIARE E DI COMANDARE A CASA NOSTRA! RIMANDIAMOLI AL LORO PAESE O IN QUALCHE ANNO SAREMO SOTTOMESSI DA QUESTE BELVE"
_1047784228753223681,Sono degli sfruttatori,Sono incompatibili con noi,Peggiorano le nostre condizioni di vita,Sono incompatibili con noi,ann01,Sono degli sfruttatori,ann05,Peggiorano le nostre condizioni di vita,ann02,False,"Che bello il modello di ""integrazione"" della sinistra: accogliere senza limiti centinaia di migliaia di finti profughi che pretendono! 
Con #DecretoSalvini porte aperte solo a veri rifugiati, TOLLERANZA ZERO verso clandestinità,accordi con tutti i Paesi di provenienza e RIMPATRI. https://t.co/Ux4On3O4Cx"
_1047840189559840770,Sono degli sfruttatori,Sono dei parassiti,Fanno quello che vogliono senza contribuire,Sono dei parassiti,ann01,Sono degli sfruttatori,ann05,Fanno quello che vogliono senza contribuire,ann02,False,"@matteosalvinimi Questi esempi di immigrati senza rispetto di Nessuno  tanto meno delle regole noi non gli vogliamo. Rispetto a chi lavora e rispetta persone,ambiente e paga le tasse,fannulloni e clandestini fuori dalla palle"
_1047860863636582401,Sono degli sfruttatori,Sono incompatibili con noi,Peggiorano le nostre condizioni di vita,Sono incompatibili con noi,ann01,Sono degli sfruttatori,ann05,Peggiorano le nostre condizioni di vita,ann02,False,"@ecodeicomuni_ec Se i padri fondatori avessero vissuto questi tempi, di sicuro NON avrebbero lasciato l'ITALIA alla mercé degli attuali #INVASORI.  Questo è certo. Ovviamente 70 anni fa NON vi era certo il problema ""immigrazione""!"
_1047870082087620608,Sono una minaccia,Sono subdoli,Sono pericolosi,Sono subdoli,ann01,Sono una minaccia,ann05,Sono pericolosi,ann02,False,"L’ordine ai giornalisti: “Nascondete i crimini degli immigrati” https://t.co/iNvz8d8GKm iI giornalai che nascondono i crimini dei CLANDESTINI si dovrebbero vergognare un immigrato e colui che entra con permesso documenti, chi entra senza e un DELINQUENTE e CLANDESTINO.WL🇮🇹"
_1047929450594230273,Sono degli sfruttatori,Sono dei parassiti,Peggiorano le nostre condizioni di vita,Sono dei parassiti,ann01,Sono degli sfruttatori,ann05,Peggiorano le nostre condizioni di vita,ann02,False,"#Boeri, dopo aver difeso l'importazione dei «migranti», ossia i fannulloni africani pagati dallo Stato, sul #redditodicittadinanza sentenzia: «Sbagliato dare soldi a chi non lavora».
Cioè: agli africani sì, gli italiani vadano affanculo.
#Governo, ma quando cazzo lo epuri questo?"
_1047961882722816001,Sono degli sfruttatori,Sono subdoli,Sono pericolosi,Sono subdoli,ann01,Sono degli sfruttatori,ann05,Sono pericolosi,ann02,False,"I profughi del Senegal. 
Fuggono dalla terribile guerra del #Senegal , dove nostri connazionali vanno in vacanza. 
Ma ci prendete proprio per fessi.
#WLItalia"
_1048195148918743040,Sono una minaccia,Sono subdoli,Sono pericolosi,Sono subdoli,ann01,Sono una minaccia,ann05,Sono pericolosi,ann02,False,"@LegaSalvini Il risarcimento ai criminali è stato sicuramente il gesto più vergognoso che alcuni giudici potessero fare contro le vittime, un premio di consolazione elargito a CHI in Italia doveva portare ricchezza e cultura anziché morte e paura,
Un vero incentivo a delinquere x i migranti!"
_1048195148918743040,Sono una minaccia,Sono incompatibili con noi,Sono pericolosi,Sono incompatibili con noi,ann01,Sono una minaccia,ann05,Sono pericolosi,ann02,False,"@LegaSalvini Il risarcimento ai criminali è stato sicuramente il gesto più vergognoso che alcuni giudici potessero fare contro le vittime, un premio di consolazione elargito a CHI in Italia doveva portare ricchezza e cultura anziché morte e paura,
Un vero incentivo a delinquere x i migranti!"
_1048235930354667520,Sono degli sfruttatori,Sono subdoli,Fanno quello che vogliono senza contribuire,Sono subdoli,ann01,Sono degli sfruttatori,ann05,Fanno quello che vogliono senza contribuire,ann02,False,@GiancarloDeRisi questo è quel che si voleva nn amano subire le nostre leggi sti migranti devono sottostare alle nostre leggi perchè nn inviare l'esercito e reprimere
_1048296975886680064,Sono tutelati,Sono dei parassiti,Peggiorano le nostre condizioni di vita,Sono dei parassiti,ann01,Sono tutelati,ann05,Peggiorano le nostre condizioni di vita,ann02,False,"#StaseraItalia 
#redditodicittadinanza 
Se penso che i soldi delle mie #tasse finiscono nelle tasche dei #rom italiani prenderei i miei soldi e gli darei fuoco. 
Va bene rispettare il #contrattodigoverno ma non trovo giusto che io debba lavorare anche x i fancazzisti. Basta. https://t.co/BcwClIUYLS"
_1048576810739556354,Sono una minaccia,Sono subdoli,Sono pericolosi,Sono subdoli,ann01,Sono una minaccia,ann05,Sono pericolosi,ann02,False,@serogeid X anni @luigidimaio e @Mov5Stelle hanno appoggiato in Italia (da abusivi) e in UE il @pdnetwork su africani rom islamici clandestini e stranieri criminali liberi impuniti.... hanno sempre tradito il popolo italiano autoctono sovrano e lo faranno sempre...
_1048941470533779456,Sono una minaccia,Sono subdoli,Sono pericolosi,Sono subdoli,ann01,Sono una minaccia,ann05,Sono pericolosi,ann02,False,"@evagiovannini @RaiTre @Mezzorainpiu Indecenza  sinistra  e migranti che legalizzano droga e tagliano vagine alle bambine; vanno  ad  assisi, Francesco  non legalizzava droga ne tagliava genitali alle bimbe. Sono in italia, ma non rispettano  le nostre leggi. Chi vuole  aiutare vada  nei  loro paesi  ad  educarli."
_1048941470533779456,Sono una minaccia,Sono incompatibili con noi,Sono pericolosi,Sono incompatibili con noi,ann01,Sono una minaccia,ann05,Sono pericolosi,ann02,False,"@evagiovannini @RaiTre @Mezzorainpiu Indecenza  sinistra  e migranti che legalizzano droga e tagliano vagine alle bambine; vanno  ad  assisi, Francesco  non legalizzava droga ne tagliava genitali alle bimbe. Sono in italia, ma non rispettano  le nostre leggi. Chi vuole  aiutare vada  nei  loro paesi  ad  educarli."
_1049401558268563456,Sono degli sfruttatori,Sono dei parassiti,Peggiorano le nostre condizioni di vita,Sono dei parassiti,ann01,Sono degli sfruttatori,ann05,Peggiorano le nostre condizioni di vita,ann02,False,La Turchia intende dare la sua bandiera ad aquarius faccia come cazzo gli pare ma il carico di finti profughi se li porta in Turchia qua nn li vogliamo già hanno rotto i coglioni abbastanza anzi se ve ne pigliate  qualche migliaio ci fate un favore
_1049413092596244490,Sono una minaccia,Sono immorali,Sono pericolosi,Sono immorali,ann01,Sono una minaccia,ann05,Sono pericolosi,ann02,False,"In un Paese civile, la cultura dei ROM non dovrebbe esistere. Questi chiedono elemosina costringendo anche i minori e rubano! Perché i filippini, i polacchi, gli ucraini trovano lavori umili e si pagano la casa, mentre i ROM devono avere assistenza? #QuartaRepubblica"
_1049909311596650502,Sono degli sfruttatori,Sono un problema,Fanno quello che vogliono senza contribuire,Sono degli sfruttatori,ann05,Sono un problema,ann01,Fanno quello che vogliono senza contribuire,ann02,False,"@Marzia_M @SoniaGrotto @mbwManzoni @lauraleghista @conci66aa @a_meluzzi @FLampunio @eryka_bo @laltraguanciama @Emanuele2002us @GiancarloDeRisi @majin @Saraspagnolo41 @soloio0509 @Palazzo_Chigi @GiuseppeConteIT @Viminale @Quirinale @GDF @Europarl_IT @Montecitorio @M5S_Senato @CorteContiPress @intuslegens @AndCappe @sherlock5stelle @faellanta @mariogiordano5 @GiorgiaMeloni @ZanchettaMauro @iosonokarma @LauraMelzo @infoitinterno @Sosromacapitale @matteosalvinimi @JunckerEU @battaglia_persa @GiusTW @V_of_Europe @EU_Commission @EmmanuelMacron @Viktor_Orban @media_patriote @GermaniaItalia @NoCorruzione @CatenaUmana @CriminImmigratl @CronacheI Fuori finti profughi e criminali dall'Italia d'Europa e fare legge che esilia i corrotti rovina civiltà🤔 @Europarl_IT
@GiuseppeConteIT 
🆘🇪🇺🇮🇹🇪🇺🆘🇮🇹🇪🇺🇮🇹🆘🇪🇺🇮🇹🇪🇺🆘 https://t.co/gnoLgarCrD"
_1049948332133634049,Sono una minaccia,Sono incompatibili con noi,Sono pericolosi,Sono incompatibili con noi,ann01,Sono una minaccia,ann05,Sono pericolosi,ann02,False,"l'islam attacca il cuore dell'europa: il Belgio! qui veramente c'è qualcosa che non va!
Il partito islamico preoccupa il Belgio: ""Non c'è parità tra uomo e donna"" https://t.co/5FIwlrH9b7"
_1049951799925506049,Sono degli sfruttatori,Sono dei parassiti,Peggiorano le nostre condizioni di vita,Sono dei parassiti,ann01,Sono degli sfruttatori,ann05,Peggiorano le nostre condizioni di vita,ann02,False,"Porteranno lo spread a 500 pur di mandare a casa il governo (regolare ) attuale poi arriverà il PD o PDL a ghettizzare l'Italia intera e renderla un letamaio più di quello che già è.
Poi daranno le nostre case agli immigrati e a noi ci cacceranno.
Questo vogliono fare
E noi zitti"
_1050106564567281664,Sono una minaccia,Sono immorali,Sono pericolosi,Sono immorali,ann01,Sono una minaccia,ann05,Sono pericolosi,ann02,False,"Da dare fuoco a tutto l'albergo ste merde vi marciano con i migranti, qui adesso che colpa hanno, potrebbero denunciare però ma diciamocela tutta fa comodo anche a loro,  cazzo anche a me piacerebbe non fare nulla tutto il giorno mangiare dormire cellulare è se capita si stupra . https://t.co/LGuHgFWzgY"
_1050160519313838080,Sono degli sfruttatori,Sono incompatibili con noi,Peggiorano le nostre condizioni di vita,Sono incompatibili con noi,ann01,Sono degli sfruttatori,ann05,Peggiorano le nostre condizioni di vita,ann02,False,"Belgio:Non c'è parità tra uomo e donna, si alla sharia. L'Islam vuole un regime segregazionista, tra maschi e femmine e tra fedi. Cosa si aspetta a buttarli tutti fuori? Vogliono imporci il loro mondo @matteosalvinimi #stopinvasione"
_1050164039731617792,Sono degli sfruttatori,Sono subdoli,Sono pericolosi,Sono subdoli,ann01,Sono degli sfruttatori,ann05,Sono pericolosi,ann02,False,"@MezzadridItalia Sicuramente lei non è un mezzadro, ma la ritengo una risorsa per aiutare a casa loro questi finti #profughi 
questi indifesi #clandestini . Buon viaggio e buona permanenza! Ah dimenticavo, meglio 100000 volte mezzadri che mezziladri"
_1050748667483840512,Sono una minaccia,Sono subdoli,Sono pericolosi,Sono subdoli,ann01,Sono una minaccia,ann05,Sono pericolosi,ann02,False,@giuliacarta @SI_sinistra @NFratoianni @PiazzapulitaLA7 Ha detto bene !! Facciamo schifo a farci invadere da immigrati e delinquenti vari che non rispettano niente delka ns civiltà!!! Mi auguro che un giorno tutti aprano gli occhi!!! Ma se continua così le donne anche aprendo gli occhi verranno la stoffa del velo
_1050748667483840512,Sono degli estremisti religiosi,Sono un problema,Hanno una cultura diversa dalla nostra,Sono degli estremisti religiosi,ann05,Sono un problema,ann01,Hanno una cultura diversa dalla nostra,ann02,False,@giuliacarta @SI_sinistra @NFratoianni @PiazzapulitaLA7 Ha detto bene !! Facciamo schifo a farci invadere da immigrati e delinquenti vari che non rispettano niente delka ns civiltà!!! Mi auguro che un giorno tutti aprano gli occhi!!! Ma se continua così le donne anche aprendo gli occhi verranno la stoffa del velo
_1050863718442110978,Sono una minaccia,Sono subdoli,Sono pericolosi,Sono subdoli,ann01,Sono una minaccia,ann05,Sono pericolosi,ann02,False,"@annalisa_parma Senta, accenda il cervello, per cortesia: quello che lei racconta è grave ma è del tutto eccezionale. I rom non vogliono lavorare, rubano e infastidiscono i passanti. Se lei li apprezza li prenda a casa sua."
_1051121169536090112,Sono una minaccia,Sono subdoli,Sono pericolosi,Sono subdoli,ann01,Sono una minaccia,ann05,Sono pericolosi,ann02,False,"@ellyesse Tanto a te che ti frega...In Svizzera,fuori dalla UE,i migranti clandestini non arrivano.Non devi vivere con un C.I.E. vicino casa,con all'interno 70 risorse,non devi subire il furto di 3 biciclette,e 2 furti in casa.Comodo farsi bella,con il culo degli altri.IPOCRITA..."
_1051171014023892992,Sono degli sfruttatori,Sono subdoli,Sono pericolosi,Sono subdoli,ann01,Sono degli sfruttatori,ann05,Sono pericolosi,ann02,False,I falsi comunisti con I'll rolex che odiano gli italiani. Su metta la supposta e prenda un traghetto assieme ai falsi migranti e torni a casa in Africa.
_1051750638294626304,Sono una minaccia,Sono subdoli,Sono pericolosi,Sono subdoli,ann01,Sono una minaccia,ann05,Sono pericolosi,ann02,False,"Ringraziare Monti, Prodi, Renzi, Letta, Gentiloni, Napolitano, Mattarella e compagnia, che hanno fatto entrare una miriade di terroristi, delinquenti, stupratori, ladri. Ma è normale, tra simili ci di aiuta."
_1052091428074078209,Sono tutelati,Sono incompatibili con noi,Peggiorano le nostre condizioni di vita,Sono incompatibili con noi,ann01,Sono tutelati,ann05,Peggiorano le nostre condizioni di vita,ann02,False,"I #migranti controllano interi rioni.
Gli interventi di polizia sono IMPOSSIBILI, perché questi popoli ostili si uniscono per linciare gli agenti.
Non dobbiamo avere paura delle parole.
Solo i #rastrellamenti militari possono fermare questo insulto osceno allo Stato e alla legge."
_1052091428074078209,Sono una minaccia,Sono subdoli,Sono pericolosi,Sono subdoli,ann01,Sono una minaccia,ann05,Sono pericolosi,ann02,False,"I #migranti controllano interi rioni.
Gli interventi di polizia sono IMPOSSIBILI, perché questi popoli ostili si uniscono per linciare gli agenti.
Non dobbiamo avere paura delle parole.
Solo i #rastrellamenti militari possono fermare questo insulto osceno allo Stato e alla legge."
_1052426995378851840,Sono una minaccia,Sono subdoli,Sono pericolosi,Sono subdoli,ann01,Sono una minaccia,ann05,Sono pericolosi,ann02,False,"I rom adesso rubano pure i cani. In Italia un rapimento ogni 15 minuti
Attraverso delle organizzazioni criminali i cani vengono poi smistati in ""allevamenti lagher"" nei paesi dell'Est

 https://t.co/ASgBvhoEpb di @ilGiornale"
_1052452459770200065,Sono degli sfruttatori,Sono immorali,Hanno una cultura diversa dalla nostra,Sono immorali,ann01,Sono degli sfruttatori,ann05,Hanno una cultura diversa dalla nostra,ann02,False,"@ros_aria7 Vai a lavorare! I mussulmani non vogliono che le loro donne imbacuccate vadano a lavorare, non si lamentassero poi se fanno la fame! Hannorottoilcazzo!"
_1052467452960038912,Sono degli sfruttatori,Sono dei parassiti,Peggiorano le nostre condizioni di vita,Sono dei parassiti,ann01,Sono degli sfruttatori,ann05,Peggiorano le nostre condizioni di vita,ann02,False,Piccoli immigrati CLANDESTINI a ..... casa in Africa! Chi non paga non mangia: ciò che è purtroppo valido per TUTTI lo sia anche per loro! #parassiti https://t.co/zfbW5PdufF
_1052634171129126914,Sono una minaccia,Sono subdoli,Sono pericolosi,Sono subdoli,ann01,Sono una minaccia,ann05,Sono pericolosi,ann02,False,"@Ceschetta1 Merde schifose , usurpatori,ladri e terroristi.
Siano maledetti"
_1052904948579610624,Sono degli sfruttatori,Sono dei parassiti,Sono pericolosi,Sono dei parassiti,ann01,Sono degli sfruttatori,ann05,Sono pericolosi,ann02,False,"Ora
TG1dicono che
Circa il 30% degli IMMIGRATI
Vivono in.povertà!
quindi:
1su3
NON ci pagherà la pensione
NON paga tasse
quindi
Li manteniamo
Li curiamo
e forse lavorano in nero percependo sussidi/ esenzioni
Inoltre nei 5 anni PD arrivati 880.000 per lo più clandestini"
_1052904948579610624,Sono tutelati,Sono dei parassiti,Peggiorano le nostre condizioni di vita,Sono dei parassiti,ann01,Sono tutelati,ann05,Peggiorano le nostre condizioni di vita,ann02,False,"Ora
TG1dicono che
Circa il 30% degli IMMIGRATI
Vivono in.povertà!
quindi:
1su3
NON ci pagherà la pensione
NON paga tasse
quindi
Li manteniamo
Li curiamo
e forse lavorano in nero percependo sussidi/ esenzioni
Inoltre nei 5 anni PD arrivati 880.000 per lo più clandestini"
_1052938826937700352,Sono tutelati,Sono dei parassiti,Peggiorano le nostre condizioni di vita,Sono dei parassiti,ann01,Sono tutelati,ann05,Peggiorano le nostre condizioni di vita,ann02,False,"Passo davanti alla scuola elementare della mia città e noto che a prendere i figli degli stranieri ci sono le madri mentre per gli italiani ci sono i nonni.
Significa che le madri italiane devono lavorare per poter campare. E gli stranieri? Ah già...per loro si raccolgono soldi!"
_1052974455532728321,Sono una minaccia,Sono incompatibili con noi,Sono pericolosi,Sono incompatibili con noi,ann01,Sono una minaccia,ann05,Sono pericolosi,ann02,False,"Guai a voi se permetterete uno scempio del genere. Questi cialtroni non devono arrivare in Italia. Sig. Ministro, cacci via subito tutti gli islamici, abbatta tutte le moschee. Liberiamoci da questi terroristi e codardi che picchiano le donne perché dagli uomini le prenderebbero."
_1053003753199153154,Sono una minaccia,Sono incompatibili con noi,Sono pericolosi,Sono incompatibili con noi,ann01,Sono una minaccia,ann05,Sono pericolosi,ann02,False,"@PiazzapulitaLA7 I BUONISTI IPOCRITI ACCOLGANO NELLE LORO CASE LE FAMIGLIE STRANIERE, NON NELLE SCUOLE CON I SOLDI DEGLI ITALIANI, MENTRE L'ISLAM DISTRUGGE LE CHIESE E NON PERMETTE LA LORO COSTRUZIONIE, PERCIO' TUTTI A CASA VOSTRA...."
_1053003753199153154,Sono tutelati,Sono dei parassiti,Peggiorano le nostre condizioni di vita,Sono dei parassiti,ann01,Sono tutelati,ann05,Peggiorano le nostre condizioni di vita,ann02,False,"@PiazzapulitaLA7 I BUONISTI IPOCRITI ACCOLGANO NELLE LORO CASE LE FAMIGLIE STRANIERE, NON NELLE SCUOLE CON I SOLDI DEGLI ITALIANI, MENTRE L'ISLAM DISTRUGGE LE CHIESE E NON PERMETTE LA LORO COSTRUZIONIE, PERCIO' TUTTI A CASA VOSTRA...."
_1053246847039557633,Sono degli sfruttatori,Sono dei parassiti,Fanno quello che vogliono senza contribuire,Sono dei parassiti,ann01,Sono degli sfruttatori,ann05,Fanno quello che vogliono senza contribuire,ann02,False,"Io mi chiedi invece che hanno fatto di male gli italiani per meritarsi I migranti vitelloni,nullafacenti.

Adamo: «Cosa hanno fatto i migranti per essere puniti così?» https://t.co/rr3qy3hTa3"
